Subject,juice_likert,juice_intense,juice_encouragement,salt_likert,salt_intense,salt_encouragement,neutral_likert,neutral_intense,neutral_encouragement,juice1_motive,juice1_like,juice1_performance,juice1_encouragement,salt1_motive,salt1_like,salt1_performance,salt1_encouragement,neut1_motive,neut1_like,neut1_performance,neut1_encouragement,juice2_motive,juice2_like,juice2_performance,juice2_encouragement,salt2_motive,salt2_like,salt2_performance,salt2_encouragement,neut2_motive,neut2_like,neut2_performance,neut2_encouragement,juice4_motive,juice4_like,juice4_performance,juice4_encouragement,salt4_motive,salt4_like,salt4_performance,salt4_encouragement,neut4_performance,neut4_motive,neut4_like,neut4_encouragement,money_strat,liq_strat,money_motive,liq_motive,posttaskliquid_complete,pos_likert,pos_arousal,pos_encouragement,neg_likert,neg_arousal,neg_encouragement,soc_neut_likert,soc_neut_arousal,soc_neut_encouragement,pos1_motive,pos1_like,pos1_performance,pos1_encouragement,neg1_motive,neg1_like,neg1_performance,neg1_encouragement,soc_neut1_motive,soc_neut1_like,soc_neut1_performance,soc_neut1_encouragement,pos2_motive,pos2_like,pos2_performance,pos2_encouragement,neg2_motive,neg2_like,neg2_performance,neg2_encouragement,soc_neut2_motive,soc_neut2_like,soc_neut2_performance,soc_neut2_encouragement,pos4_motive,pos4_like,pos4_performance,pos4_encouragement,neg4_motive,neg4_like,neg4_performance,neg4_encouragement,soc_neut4_performance,soc_neut4_motive,soc_neut4_like,soc_neut4_encouragement,soc_money_strat,soc_strat,soc_money_motive,soc_motive,posttasksocial_complete
101,5,6,6,3,6,4,2,5,4,5,6,6,6,4,5,5,4,5,4,5,3,6,6,6,7,6,6,6,7,5,4,5,6,7,7,6,7,7,7,6,7,6,7,5,6,"For the $$$$ trials, I felt myself become more alert, and occasionally mutter the cue aloud to myself beforehand the stimulus was presented.","I muttered the cue aloud for the saltwater solution more often than the juice or neutral. However, for the juice I felt naturally much more alert and was not absentmindedly playing with the straw in my mouth like I was for the other two.","I was equally motivated for the $ and $$ trials, but more motivated for the $$$$ because that indicated a larger amount of money.","Unconsciously, I think I was more motivated for the juice trial, since I noticed that the most liquid was emptied out of the syringes for that feedback compared to the other two.",2,2,6,2,6,6,6,4,3,4,4,4,6,4,6,6,6,6,3,3,6,3,4,4,7,4,6,6,7,6,4,4,7,4,5,4,7,4,7,7,7,7,6,6,6,5,"For the $$$$, I made sure especially to pay attention to the cue and would either say aloud vowel-constenant if it was the letter cue, or odd-even if it was the number cue.","I often found myself responding aloud to the neutral feedback with equally neutral responses. However, I would respond much more positively to the negative feedback while the positive feedback I would try to tune out.","I was slightly more motivated for the $$$$ trials, as those would result in a higher monetary reward.","I was much less motivated by the neutral feedback compared to the other two. However, I was most motivated by the negative feedback since I found it much less distracting than the positive one.",2
103,7,6,7,1,7,3,5,1,4,7,7,3,6,1,1,1,2,6,6,3,4,6,6,3,6,2,2,2,3,5,5,3,5,5,7,2,6,2,2,1,2,4,3,4,4,No,No,No,I did not like the saltwater. I tried to keep going but it was not pleasing ,2,6,5,5,5,5,4,6,4,5,2,3,2,3,1,1,2,2,3,2,2,2,3,3,3,3,2,2,2,2,3,2,2,2,6,3,1,4,5,2,1,4,6,5,1,4,I tried to get as many right in a row that I could.,I ignored the negative feedback,"Yes, I was more motivated for the $$$$ trials but I was too anxious to get them right ",I was indifferent. I liked hearing  both feedback and the negative feedback made me laugh,2
105,5,3,6,2,5,3,4,2,,5,5,5,5,3,3,4,2,5,4,5,4,6,5,5,6,2,2,5,2,3,4,5,3,7,6,5,6,2,3,5,2,5,7,5,5,No,No,The ones for more money of course I wanted to make sure I got those correct in a timely fashion to maximize the monies I could walk away with but I also kept thinking any money is money and can help so get this one right too.,I didn't particularly want to drink the saltwater so I wasn't hurt if I got one of those questions incorrect or moved too slow,2,3,2,4,4,2,4,4,1,4,6,5,5,4,6,4,5,2,5,3,3,4,6,4,5,5,6,4,3,2,6,3,3,2,7,5,5,5,7,5,4,4,7,6,3,4,"No, not really.",No I essentially ignored it so that I could focus because no matter what they said it was not changing the correct answer,Initially I got more worked up for the $$$$ obviously. I could use the money and it seemed easy enough. Then I realized money is money and if I need it then I need to keep the same energy at every level.,"No, they were all kind of funny more than motivating. The people did not know me and I did not know them so it was easy to disassociate.",2
106,7,5,7,1,7,1,2,2,3,6,7,6,7,1,1,4,2,4,5,4,4,6,6,6,5,2,3,4,1,3,3,4,4,7,7,6,7,3,1,5,3,6,6,5,5,I was indifferent between all trials.,"For the salt water, I would often not answer/purposely miss two $ trials before answering one $$$$ trial. I was indifferent on the $$ trials.",I was not motivated particularly.,I had to implement strategies when the saltwater became discomforting.,2,4,5,4,6,4,5,5,2,3,5,6,6,5,6,6,6,5,5,3,5,3,6,6,5,5,6,5,6,5,6,5,6,5,5,6,5,5,6,6,6,6,5,4,5,5,No.,No.,No.,"No, none of the social feedback caused me to feel physically uncomfortable.",2
107,7,4,6,1,6,2,4,4,5,4,5,6,6,2,2,6,3,5,5,6,4,6,4,6,6,4,3,2,1,6,4,4,2,7,6,6,7,6,2,5,5,6,6,4,6,NO the same,No the same,yes the $ was less motivated,no,2,6,7,6,2,2,5,5,5,5,5,5,4,5,3,4,3,2,5,4,5,4,6,6,4,6,4,3,5,4,6,5,4,5,6,5,3,6,6,5,3,5,6,5,5,4,No the same,no the same,yes more cash more motivation,the same,2
108,6,4,5,2,6,2,3,2,3,5,4,4,5,1,1,1,2,3,4,3,3,4,5,5,5,1,1,1,2,3,2,2,3,5,5,4,6,2,1,1,2,2,4,3,2,N/A,"When receiving the liquid feedback in the form of saltwater, I oriented to tube in my mouth such that It did not directly touch my tongue. After enough of the saltwater filled my mouth, I swallowed it in one large gulp periodically. For the neutral solution, I initially used the same strategy as I did for saltwater, but after I realized the solution was neutral, I just let tube hang freely in my mouth and swallowed periodically. For the juice, I also let the tube hang freely in my mouth and swallowed regularly with each liquid feedback. ",I was more motivated the '$$$$' trials than the other trials because they were worth more money.,I was least motivated with the saltwater due to its extremely saline taste. I was most motivated with the juice due to it sweet taste. ,2,4,5,5,2,1,4,3,4,4,5,6,5,5,5,4,6,3,5,4,4,4,5,5,5,5,5,4,3,3,4,4,4,4,7,5,5,6,7,5,5,2,5,7,5,4,N/A,"During the negative feedback portion, I would sometimes look away from the screen. ","I was less motivated by '$,' and '$$,' as opposed to '$$$$.' This was because my potential success or failure seemed to have a minimal impact on the amount of money that I could earn. ",I think I was more motivated during the negative feedback because I was determined to not allow the negative feedback to hinder my performance. ,2
109,6,5,6,3,6,3,4,4,4,4,5,4,4,4,5,4,4,4,5,4,4,5,5,6,5,5,5,6,5,5,5,6,5,7,7,6,7,7,7,6,7,7,7,6,7,"Not really, I just wanted to get them all correct so I just tried to stay focus and use the same tactics.",No,"No, but if I got an answer wrong on the $ questions, I was less upset than the $$ and $$$$ questions.",No,2,6,5,6,4,5,3,1,1,4,3,3,5,4,3,3,5,4,3,3,5,4,5,5,5,5,5,5,5,5,5,5,5,5,6,6,6,6,6,6,6,6,6,6,6,6,No,No,"Not necessarily more or less motivated, but I was more upset when I got $$ or $$$$ wrong than $.",No,2
112,7,5,7,1,4,2,3,2,4,5,5,3,7,1,1,4,1,2,3,4,2,7,7,5,6,3,1,4,3,3,3,3,3,7,7,2,7,2,1,3,4,4,4,3,4,I focused slightly more on the $$$$ trials than the other two.,Not really.,Yes. I was more motivated on the trials worth more money.,"Yes. The juice felt like a reward, and I wanted to get it each time, regardless of the monetary value. The saltwater felt like a punishment, and I was not motivated at all to answer correctly during that trial.",2,1,7,1,2,1,4,6,1,5,1,1,5,1,2,3,5,3,2,4,4,4,2,1,4,2,3,3,5,4,4,6,5,4,3,1,2,2,5,3,2,2,3,6,7,5,Not really.,"Yes. I did my best to zone out and just look at the screen out of the corner of my eyes when receiving positive feedback, because I found the feedback to be awkward and, to a much greater degree than for any other trials, upsetting.",Yes. I was less motivated for trials in which I was going to receive less money because I was less willing to expend the energy I would need to to focus on the task at hand.,"Yes. I was almost an incentive to miss questions, because that meant I would not receive the social feedback, on both the positive and negative feedback trials (more so positive). I thought the neutral feedback was funny, so that motivated me.",2
113,7,5,7,2,6,1,5,1,5,5,5,6,5,5,3,5,3,6,6,5,6,7,7,5,7,6,2,5,6,6,6,6,6,7,7,5,7,7,2,5,2,5,7,7,7,nope,nope,"I was motivated extra for $$$$>$$>$, but still tried for all of them because it's still money","saltwater decreased enjoyment, but I staid motivated for the $$$$, although I was less motivated on $$ and $",2,4,2,5,2,5,2,3,3,3,3,3,5,6,3,3,3,6,2,3,5,6,5,6,5,5,5,4,5,5,5,5,5,6,7,7,5,7,7,7,5,7,7,7,6,7,nope,nope,I was more motivated by $$$$>$$>$,The negative feedback distracted me a lot even though I really didn't find them hurtful and a few were just comical. A few positive ones creeped me out or didn't seem genuine. The neutral ones were bizare and I felt turned off by the folks.,2
114,6,4,5,3,5,4,6,1,6,4,6,4,5,4,3,4,3,4,5,4,5,4,6,4,6,4,3,4,3,4,5,4,5,4,6,5,6,4,3,3,3,4,5,5,5,No,No,No ,No ,2,4,2,4,5,6,6,4,2,4,4,4,6,4,5,6,6,6,4,4,5,4,4,5,5,4,6,5,5,6,3,4,4,4,4,5,5,4,6,6,5,6,5,4,4,4,No,"Negative, kind of made  me want to do better",No ,"The positive and Neutral were unmovtivating to me, because since I had the negative first it felt like it pushed me more than the other two types of feedback. ",2
116,7,5,6,1,7,1,3,4,4,7,7,7,7,1,1,1,1,2,3,3,4,7,7,7,7,1,1,1,1,4,3,4,4,7,7,7,7,3,1,2,1,5,5,4,4,"For the most part, I tried to ignore the dollar signs (unless it was saltwater - see response below).","With saltwater, I tried to focus on $$$$ trials and not the others, because it was a strong discourager, regardless of the extra money. Eventually, I just gave up, and tried to get correct answers, but not too quickly because yuck saltwater.",I tried not to pay attention to the difference in dollar signs in each trial.,"Neutral solution was bleh, didn't really affect anything. Saltwater completely unmotivated me. And surprisingly, I really enjoyed the juice trials and definitely was way more motivated and did great on that one.",2,6,2,6,2,3,1,4,1,4,4,5,5,6,6,1,4,3,3,4,5,4,4,5,5,6,6,1,4,3,3,4,5,4,4,5,5,6,6,1,4,3,3,4,5,4,I tried not to pay attention to the dollar signs.,None.,"A little more motivated with more dollar signs, but again, I tried mostly to ignore it so it wouldn't be a distraction.","Definitely more motivated on negative feedback, least motivated in neutral. Negative feedback made me want to do better (proving it didn't affect me, etc.).",2
117,6,5,4,2,7,6,7,4,4,5,5,5,5,5,3,4,2,6,6,6,4,6,6,5,5,6,4,4,2,6,6,6,6,7,7,5,7,7,2,5,2,7,7,7,5,no,no,i was more motivated in the $$$$ trials because i want more money,i was less motivated with the saltwater because it was gross,2,7,5,6,2,7,7,4,4,4,7,6,5,5,7,5,5,5,7,6,5,6,7,6,5,5,7,6,6,4,7,6,5,5,7,6,6,7,7,6,5,7,7,6,6,7,No,no,i was most motivated on the $$$$ trials,i was more motivated during the positive trials,2
118,6,5,6,1,7,2,2,5,3,5,6,6,6,4,1,4,3,4,3,5,4,6,6,5,6,4,1,4,2,5,4,5,4,7,7,5,6,5,1,4,3,4,5,3,4,I fidgited more on the $$$$ and it made me click the wrong answer more often.,"No, but I sometimes really didn't want to get the answer right on the saltwater liquid feedback.","I was less motivated for the $ trials, but I still tried pretty hard.",I was definitely less motivated for both the saltwater and water trials.,2,2,1,4,2,1,3,1,1,4,3,4,4,4,3,4,4,4,3,3,4,3,5,4,5,5,5,4,5,5,4,3,5,5,6,5,5,5,6,4,5,4,5,4,5,4,I was a lot more on edge during the $$$$ trials; sometimes this would result in accidentally pressing the wrong key because I am so alert.,No.,I was more motivated for the $$$$; I always perked up a bit more when I saw the $$$$ symbol.,No.,2
120,7,5,7,1,7,1,3,5,2,7,5,6,7,1,1,2,1,2,1,1,1,7,7,7,7,1,1,2,1,2,1,1,1,7,7,7,7,1,1,2,1,5,3,2,5,"For $$$$ trials, I was more alert and more attentive than for others. ","I tried to get everything correct for the juice feedback.  For the saltwater, I tried to avoid getting any feedback as much as possible and only tried to answer correctly once in a while.  For the neutral solution, I only tried to answer the $$$$ trials.","I was much more motivated on the $$$$ trials than for any other trial, except in the saltwater solution.  I wanted to make sure I got the maximum amount of $$$$ correct.","I was very unmotivated by the saltwater and tried to avoid it as much as possible.  The juice motivated me to get everything correct.  The neutral solution also unmotivated me, but I was fine with answering the $$$$ questions.",2,5,2,4,1,1,1,4,1,4,2,3,5,3,2,2,4,2,4,4,4,3,5,5,4,4,3,3,4,2,4,4,3,4,7,7,5,7,7,7,4,7,5,7,7,7,I was much more attentive during the $$$$ trials and the $$ trials.  I also spoke out loud whether it was letter or number to make sure I enhanced accuracy.,I ignored the negative feedback by looking away from the screen and zoning out.,I was much more motivated on the $$$$ trials and was more alert and attentive.,No.,2
121,7,6,7,1,7,1,5,2,5,7,7,7,7,3,2,2,2,4,5,4,5,7,7,7,7,1,1,3,3,5,5,5,4,7,7,7,7,5,5,3,3,5,5,5,5,"Overall, I didn't notice too much between $ and $$, but when $$$$ showed up I tended to try and pay attention more.","Overall, the juice feedback was very encouraging. I tended to be more alert and upright during the juice trial. ",I was more motivated for the $$$$ and equally motivated for $ and $$.,"I was less motivated for saltwater, more motivated for juice, and slightly motivated for water. ",2,3,3,4,4,3,5,7,5,6,5,5,5,5,5,5,5,5,5,5,5,5,5,5,5,5,5,5,5,5,5,5,5,5,7,7,3,7,7,7,3,7,2,7,7,7,"For the most part, in the social experiment compared to the juice trials I noticed the number of $ less.",I did not actively use any different strategies.,Typically I had more motivation on $$$$ trials,"I don't know if this counts as motivation, but it was easier to pay attention to the trials and stay awake/not drift off to sleep with the social feedback trials. ",2
126,7,4,7,1,4,2,4,2,5,6,4,4,4,4,1,6,2,4,4,4,4,6,6,5,6,4,1,6,5,4,4,4,4,7,7,5,7,6,1,6,4,4,4,4,4,"I didn't notice the dollar signs, so I didn't have a strategy.",I did not use any different strategies.,"No, because I didn't notice them.",I was actually happy when I got a trial wrong on the saltwater experiment because I did not like the taste. That was not true for the other two experiments.,2,4,4,4,4,6,1,4,2,2,4,4,4,4,4,4,4,4,4,4,4,4,4,4,4,4,4,4,4,4,4,4,4,4,4,4,4,4,4,4,4,4,4,4,4,4,No.,No.,I didn't notice the sign.,I was more motivated during the negative trials because I thought they were funny.,2
129,6,6,5,2,7,2,4,4,4,4,4,4,4,1,1,3,1,3,3,3,3,5,5,5,5,2,2,4,2,4,4,4,4,6,5,3,6,3,2,4,2,5,5,5,5,I did not.,I really did not like the saltwater task so I don't think I tried has hard on that task.,No.,I was less motivated for the saltwater task.,2,6,4,6,2,5,2,4,4,4,7,6,3,5,4,3,2,2,4,4,4,4,5,5,4,5,5,3,3,3,5,5,5,5,6,6,2,6,6,3,2,3,6,6,6,6,I tried to focus more on the trials that were worth more money.,No.,I was more motivated for the trials that were worth more money.,No.,2
130,5,5,5,1,6,1,7,1,4,2,3,4,2,1,1,2,2,7,5,5,5,6,5,4,4,2,1,3,2,7,5,5,5,6,6,5,6,5,1,4,2,5,7,7,6,"If I had messed up a few trials and the next was a $$$$, I found myself attempting to refocus given the higher reward. For $ trials, especially on saltwater, I was almost relieved if I didn't receive liquid feedback.",N/A,"I think I was overall more motivated on $$$$. It wasn't an intentional strategy, but the $$$$ would act as an alert the more fatigued I got through the experiment.","I was definitely less motivated by the saltwater, because the I strongly disliked the taste. Between juice and neutral, I didn't find either to be more motivating than one another, but more motivating than the saltwater condition.",2,5,2,4,2,4,3,4,1,4,5,4,5,5,5,3,4,5,5,3,4,4,6,4,5,5,5,2,4,4,5,3,5,5,6,5,5,6,6,3,6,6,5,6,6,6,"I was more focused on the different in the attention classification for these blocks, and often found myself unaware of the $ value distribution for each trial.","With negative feedback, I often would repeat the button conditions (even/consonant for 3, odd/vowel for 4) during the feedback which made it less distracting. For positive and neutral, I did not use any particular strategy.","For the select trials that I was aware of the $ classification, I was more motivated by the $$$$ as it was worth more. But overall, I don't think my motivation differed greatly.","I was more motivated for negative feedback, as getting the right answer seemed almost like counteracting the negative statements.",2
131,5,4,5,1,6,3,2,4,2,5,5,6,4,6,1,6,3,3,2,6,4,6,6,6,6,5,2,5,5,5,2,6,5,5,6,5,4,5,1,5,5,6,5,4,4,not really,not really,"compared to last week, after I realized that each $ is only worth a cent, I became less motivated and serious. ",not really,2,7,6,6,7,2,7,2,1,1,7,7,6,6,7,7,7,7,7,7,6,4,7,7,6,6,7,7,7,7,7,7,6,2,7,7,4,6,7,7,5,7,5,7,7,6,not really,not really,not really,not really,2
133,7,5,7,3,6,2,3,4,3,6,7,5,6,3,3,5,2,4,6,5,5,7,7,5,7,4,3,5,2,5,4,5,5,7,7,6,7,6,4,5,4,5,6,6,5,No,"I tried to swallow the saltwater all at once, so that the taste didn't linger longer than it had to. ",I suppose I was slightly more motivated on the $$$$ trials.,I was so much more motivated in the juice trials (I also just genuinely love apple juice). ,2,5,1,6,2,1,6,3,1,4,5,7,6,6,4,2,3,2,4,5,4,3,5,6,5,6,5,3,3,2,5,5,5,4,7,7,5,7,6,3,5,3,5,5,5,3,"I especially tried to focus on the $$$$ trials, but beyond that, no.",I tried to remind myself of my capabilities during the negative feedback especially.,I was more motivated during the $$$$ trials because there was more at stake. ,"Yes, during the negative feedback I was less motivated because I knew getting a correct answer would require being insulted/receiving negative feedback and I disliked that. ",2
134,3,3,2,3,2,2,3,1,2,4,4,4,5,4,4,4,5,4,4,4,5,5,5,4,6,5,5,4,6,5,5,4,6,7,7,4,7,7,7,4,7,7,7,4,7,I paid more attention as the number of $s increased.,no,"$, as the reward was less.",no,2,1,1,1,1,1,1,4,4,4,3,3,4,4,3,3,4,4,3,3,4,4,4,4,4,5,4,4,4,5,4,4,4,5,5,5,4,7,5,5,4,7,5,5,4,6,I was more focused as the no. of $s increased.,no,Less motivated on $ as the reward was less,No,2
135,6,6,6,2,2,2,3,3,3,2,2,2,2,2,2,2,2,2,2,2,2,4,4,4,4,4,4,4,4,4,4,4,4,4,4,4,4,4,4,4,3,,6,6,6,no,no,no,no,2,4,2,4,4,4,4,4,4,4,6,4,4,4,4,4,4,4,2,2,2,2,4,4,4,4,4,4,5,5,4,4,4,3,7,7,7,6,7,7,6,7,7,7,6,7,no,no,"more dollars signs, more motivated",no,2
136,2,2,1,1,1,1,3,3,1,2,3,4,2,1,1,1,1,5,4,4,2,4,4,3,3,1,1,3,1,6,5,4,2,3,3,4,3,2,2,2,2,4,7,7,5,,,more motivated with money,less with salt. hard time swallowing,2,3,2,6,5,2,4,4,4,4,4,4,5,5,4,3,4,3,4,4,3,3,5,5,5,5,5,5,4,1,5,5,4,4,7,6,3,2,7,7,7,3,7,5,5,4,,,,,2
137,4,5,6,2,5,3,4,5,6,5,5,5,5,3,2,2,4,3,4,4,4,5,5,5,5,2,2,3,3,4,5,4,4,6,5,5,5,3,2,3,3,6,5,5,5,When I saw the $$$$ I tried to pay closer attention to the buttons I'd be pressing if the cue was a number. ,I didn't use different strategies.,"I was more motivated for the $$$$, neutral about $$, and less motivated for $. I didn't think the benefits of the $ trials outweighed the effort I would use to focus on pressing the correct buttons.","I was less motivated during the saltwater trials. I didn't enjoy the taste of the liquid, so I was just waiting for the block to end.  For juice block I was more motivated because I liked the flavor of the liquid, and the juice feedback encouraged me to perform better.",2,5,6,5,2,4,3,3,3,4,5,5,5,6,5,6,6,3,4,5,4,4,6,6,6,6,5,5,5,5,4,4,4,4,7,6,7,6,6,7,6,5,5,4,5,5,I paid more attention to the buttons I would press when there were $$$$ trials and focused on the screen.,No,"Less motivated on $ trials, because the reward didn't seem enticing.",I was more motivated with negative feedback because I felt compelled to prove myself.,2
138,6,4,6,2,5,4,4,2,4,6,6,5,6,5,2,5,4,4,4,4,4,5,6,5,6,5,3,4,3,4,4,4,5,7,6,5,7,5,4,4,4,4,5,4,5,"Overall, I would treat '$' and '$$' trials the same. When I saw the '$$$$' I would focus my attention more. ","I enjoyed the juice feedback the most, so during those trials I was more focused on trying to answer quickly.",I felt more motivated during the '$$$$' trials.,"Yes, I felt more motivated during the juice trials and less motivated during the saltwater trials.",2,5,5,5,1,4,2,3,2,4,5,4,5,4,3,2,2,2,4,4,4,4,4,4,4,4,3,3,3,3,4,4,4,4,5,6,4,5,4,4,3,4,5,4,4,4,No,I tried to ignore the negative and neutral feedback.,I was less motivated on the $ trials.,I was less motivated on the negative trials.,2
139,6,6,6,2,2,3,5,3,4,5,6,6,5,5,2,5,2,5,4,6,4,6,6,5,5,6,2,5,2,6,5,5,4,7,6,5,5,6,2,4,3,4,6,4,4,,,I was a bit more motivated for the $$$$ trials.,I was a bit more motivated for the juice and less motivated for the saltwater trials.,2,4,4,4,3,4,4,3,4,4,5,3,3,4,6,3,3,4,3,3,3,4,4,3,4,4,4,3,4,4,4,3,4,4,6,3,3,4,6,4,4,4,3,5,3,4,"I tried to be more alert for the $$$$ trials, but it may have just stressed me out and negatively impacted my performance.",I tried to ignore the negative feedback more so than the others. ,"I was more motivated on the $$$$ trials, and slightly more motivated on the $$ trials.","No, the feedback didn't have an impact on my motivation levels, but my exhaustion did- I started with the Negative, so by the time I got to Positive and Neutral, I felt less motivated due to exhaustion.",2
140,6,6,5,1,6,1,4,4,4,7,6,4,5,1,1,2,1,3,5,2,3,3,3,3,3,1,1,2,1,2,3,2,2,6,6,4,4,2,1,2,2,3,3,3,3,No,No,No,I was a lot less motivated during the saltwater trials,2,5,4,1,2,1,2,4,4,3,4,5,3,3,4,4,4,4,2,2,3,3,4,4,2,4,4,4,4,4,4,4,4,4,4,4,4,4,4,4,4,4,5,5,6,5,No,No,Maybe a little less on the $,,2
142,6,4,5,2,6,2,4,4,4,5,5,3,5,2,1,3,2,5,5,6,5,6,6,6,6,4,3,4,3,5,5,5,5,7,7,6,7,7,4,7,5,6,7,5,6,I tried to ignore the values but I found myself focusing more when the stakes were higher.,I didn't use different strategies although I was more hesitant to click the correct answer in the saltwater trials when the stakes were lower. ,"I was most motivated by the $$$$, especially when I was getting saltwater because I knew that other trials would probably be less worth the averse taste. ",I was less motivated with the saltwater and more motivated for the juice. ,2,5,3,4,4,4,4,2,2,4,2,2,3,3,2,2,4,2,5,2,4,2,5,4,4,4,5,4,3,4,5,3,4,5,6,5,5,6,6,6,5,6,6,6,4,6,I tried to focus more for the $$ and $$$$ trials than the $ trial,I didn't really have different strategies based on feedback although I found the neutral responses more boring than the others.,"I was less motivated for the $ trials, especially later when I was fatigued. ",I was less motivated during the neutral trials I think because the phrases were meaningless and boring. Otherwise my apparent motivation wasn't greatly affected by social feedback.  ,2
143,7,6,7,1,7,1,5,4,5,6,7,6,6,1,1,1,1,5,5,5,6,7,7,6,7,1,1,1,1,6,5,6,5,7,7,6,7,1,1,1,1,6,7,5,7,"I tried to stay indifferent to the different $ levels this time because in the first session, my nervousness in making sure to get the $$$$ trials right actually made me do worse.","I tried to get as many correct for the juice and neutral solutions, but I was more motivated with the juice. With the saltwater, I tried to make sure I did NOT get any right. ",$$$$ was still most motivating because it offered the most money.,"Least motivated with the saltwater solution, most motivated with the juice solution. ",2,5,3,5,4,4,4,3,2,4,6,4,4,4,6,4,4,4,4,3,5,3,6,4,4,5,6,4,4,5,6,3,4,5,7,4,4,6,7,4,4,6,7,4,4,6,I got more nervous before $$$$ trials but didn't use different strategies.,No. ,less motivated on the $ because less monetary gain. ,No. ,2
144,7,5,7,4,6,5,4,4,4,7,7,6,7,7,6,6,6,6,4,5,5,7,7,7,6,5,5,5,5,5,5,5,5,7,7,5,6,7,4,5,5,7,5,5,5,no,no,more motivated to perform well on $$$$ because there is more reward,"yes, most motivated on juice",2,1,2,5,7,4,2,4,4,4,4,4,4,4,4,4,4,4,4,4,4,4,5,4,5,4,4,4,4,4,5,5,5,5,6,5,5,5,6,4,4,4,7,4,4,4,,,More motivated for more money,a little less motivated for negative. I didn't like hearing the insults,2
145,6,6,5,1,7,1,3,2,4,4,6,6,6,1,1,1,1,4,3,6,3,5,5,5,5,1,1,1,1,4,3,5,3,6,4,4,5,1,1,1,1,4,6,4,5,I tried to ignore the money signs for each trial but ultimately that was impossible and $$$$ held more pressure,"I did the same thing for neutral and juice, but neutral felt like less pressure. The saltwater trials I started by trying to do the wrong answer and then only doing the $$$$, but it was not worth it. Once I realized you did not have to click anything, I just left the trial running so I did not accidentally get the right answer.",I was more motivated by the $$$$ but would have liked to get them all right,Way less motivated by the salt water,2,6,3,6,1,3,2,5,1,4,5,5,5,6,6,3,5,2,5,5,6,3,6,4,5,5,6,3,5,2,6,5,6,3,6,1,2,4,6,1,2,1,4,6,2,2,"No, however I felt more pressure on the $$$$ trials and often psyched myself out",I did not,I was more motivated by the $$$$ but it did not cause me do do any better,I was more motivated during the negative feedback to get personal satisfaction. However I felt it was easier to perform better with neutral feedback,2